{"id":297789562,"id_str":"297789562","name":"Katelyn Sievert","screen_name":"katiesvt","location":"Greater Vancouver","profile_location":{"id":"216dd1bcf824f9f7","url":"https:\/\/api.twitter.com\/1.1\/geo\/id\/216dd1bcf824f9f7.json","place_type":"unknown","name":"Greater Vancouver","full_name":"Greater Vancouver","country_code":"","country":"","contained_within":[],"bounding_box":null,"attributes":{}},"description":"Musician, plays and makes video games and I does webdev too","url":"https:\/\/t.co\/3xyx8gOn38","entities":{"url":{"urls":[{"url":"https:\/\/t.co\/3xyx8gOn38","expanded_url":"https:\/\/soundcloud.com\/katelyn-sievert\/","display_url":"soundcloud.com\/katelyn-siever\u2026","indices":[0,23]}]},"description":{"urls":[]}},"protected":false,"followers_count":24,"friends_count":80,"listed_count":1,"created_at":"Fri May 13 03:32:23 +0000 2011","favourites_count":246,"utc_offset":-28800,"time_zone":"Pacific Time (US & Canada)","geo_enabled":true,"verified":false,"statuses_count":114,"lang":"en","status":{"created_at":"Thu Nov 24 19:35:05 +0000 2016","id":801871783871807488,"id_str":"801871783871807488","text":"I added a video to a @YouTube playlist https:\/\/t.co\/sXfnZO7fux Even More of Far Cry: The First [canceled]","truncated":false,"entities":{"hashtags":[],"symbols":[],"user_mentions":[{"screen_name":"YouTube","name":"YouTube","id":10228272,"id_str":"10228272","indices":[21,29]}],"urls":[{"url":"https:\/\/t.co\/sXfnZO7fux","expanded_url":"http:\/\/youtu.be\/5PBcHbuJAKk?a","display_url":"youtu.be\/5PBcHbuJAKk?a","indices":[39,62]}]},"source":"\u003ca href=\"http:\/\/www.google.com\/\" rel=\"nofollow\"\u003eGoogle\u003c\/a\u003e","in_reply_to_status_id":null,"in_reply_to_status_id_str":null,"in_reply_to_user_id":null,"in_reply_to_user_id_str":null,"in_reply_to_screen_name":null,"geo":null,"coordinates":null,"place":null,"contributors":null,"is_quote_status":false,"retweet_count":0,"favorite_count":0,"favorited":false,"retweeted":false,"possibly_sensitive":false,"lang":"en"},"contributors_enabled":false,"is_translator":false,"is_translation_enabled":false,"profile_background_color":"000000","profile_background_image_url":"http:\/\/abs.twimg.com\/images\/themes\/theme1\/bg.png","profile_background_image_url_https":"https:\/\/abs.twimg.com\/images\/themes\/theme1\/bg.png","profile_background_tile":false,"profile_image_url":"http:\/\/pbs.twimg.com\/profile_images\/801501006550794240\/rRUrquC9_normal.jpg","profile_image_url_https":"https:\/\/pbs.twimg.com\/profile_images\/801501006550794240\/rRUrquC9_normal.jpg","profile_link_color":"3B94D9","profile_sidebar_border_color":"000000","profile_sidebar_fill_color":"000000","profile_text_color":"000000","profile_use_background_image":false,"has_extended_profile":false,"default_profile":false,"default_profile_image":false,"following":null,"follow_request_sent":null,"notifications":null,"translator_type":"none"}